,Bear,Cat,Jaguar,Rabbit,Lizard,Pig,Mama,Salamander,Gnu
crime,You should ask mom first{a}All I know is I woke up to Rachel screaming.+I rushed upstairs to find that horrible site.+I called Ms. Jaguar immedietly to see him.+She examined the body/c so she might be more useful.,I think you should ask Madam Bear first{a}I wrote it all down in my journal+Let's see…+6:00 PM The first guests arrives/c Mr. Lizard and his wife Mrs. Salamander.+ Mr. Pig arrives late/c as always/c at around 7:30 PM.+Master Beric left the dinner table to his room at 10:30 PM after a fight errupted between him and Mr. Lizard.+Most of the guests left after the argument/c however/c Mr. Lizard and Mrs. Salamander opted to stay since they were tired.+Mr. Pig was drunk/c of course/c and decided to stay too.+The guests stayed up with Madam Bear and her son until around 12:00 AM when all went to sleep.+ Madam Bear could not sleep and came down to the kitchen to talk to me at around 1:00 AM.+Ms. Rabbit and I were done cleaning the dishes at around 2:00 AM/c at which point We both went to sleep in our dorms. Located outside this house/c in the other building.+We woke up at 6:00 AM to start working around the house.+We found Madam Bear sleeping in the living room.+When Ms. Rabbit went to check on Master Bear/c she...+I swear it was the most horrifying scream I heard in my life.+and Master Bear he was...+...dead/c stabbed.+That's all I have/c maybe Ms. Rabbit would know more.[o],You should start by asking Mrs. Bear{a}I examined the *licks lips* body.+I suggest you take a look before we discuss it.{b}I think you saw what I saw.+Not much blood.+This tells me that the *licks lips* stabbing happened AFTER death.+Yes/c the cause of death is for once NOT the big knife stuck to the victim's body.+It's hard to determine exactly when death occured/c but I'd say between 12:00 AM and 3:00 AM.+As for cause of death/c my money is on some fast acting poison.+That's all I have for now.+Feel free to look around.,Madam Bear should know more+Come back after you've talked to her.{a}Madam Bear was upset about something.+ I saw her arguing with Master Bear yesterday before dinner.+Then Master Bear had another argument with Mr. Lizard during dinner.+He was very upset he went to his room.+In the morning Madam Bear was sleeping in the living room.+Then I found him.+I still can't get the Image out of my head.[o],You should begin by asking the Mrs. Bear.{a}I am not sure exactly what happened/c all I know is the maid seems to have found the body and woke me up with her scream.,Speak with the lasy of the house .{a}*Oink* I was kinda out of it yesterday so I will not be much help.+They told me the maid was screaming in the morning or something but I didn't hear it *oink*.,We were celebrating the opening of a new branch of Bear and Co Inc.+Lawrence Lizard is going to be the head of that branch.+There was a fight/c Lawrence said something that angered Beric so Beric flipped out and went to his room.+Some of the guests/c Mr. Lizard/c Mrs. Salamander/c and Mr. Pig/c were tired or drunk so they stayed over in the guest room.+In the morning we heard Ms. Rabbit screaming and...+... and he was dead.[a],Mrs. Bear would know more.{a}I am sorry I can't help much.+I only heard the scream.,Mrs. Bear would know more.{a}I wasn't here yesterday but I heard Rachel scream and came in as fast as I could.+I went in after Mr. Cat and saw the body.+Horrifying stuff.
yesterday,You should ask mom first{a}All I know is I woke up to Rachel screaming.+I rushed upstairs to find that horrible site.+I called Ms. Jaguar immedietly to see him.+She examined the body/c so she might be more useful.,I think you should ask Madam Bear first{a}I wrote it all down in my journal+Let's see…+6:00 PM The first guests arrives/c Mr. Lizard and his wife Mrs. Salamander.+ Mr. Pig arrives late/c as always/c at around 7:30 PM.+Master Beric left the dinner table to his room at 10:30 PM after a fight errupted between him and Mr. Lizard.+Most of the guests left after the argument/c however/c Mr. Lizard and Mrs. Salamander opted to stay since they were tired.+Mr. Pig was drunk/c of course/c and decided to stay too.+The guests stayed up with Madam Bear and her son until around 12:00 AM when all went to sleep.+ Madam Bear could not sleep and came down to the kitchen to talk to me at around 1:00 AM.+Ms. Rabbit and I were done cleaning the dishes at around 2:00 AM/c at which point We both went to sleep in our dorms. Located outside this house/c in the other building.+We woke up at 6:00 AM to start working around the house.+We found Madam Bear sleeping in the living room.+When Ms. Rabbit went to check on Master Bear/c she...+I swear it was the most horrifying scream I heard in my life.+and Master Bear he was...+...dead/c stabbed.+That's all I have/c maybe Ms. Rabbit would know more.[o],You should start by asking Mrs. Bear{a}I examined the *licks lips* body.+I suggest you take a look before we discuss it.{b}I think you saw what I saw.+Not much blood.+This tells me that the *licks lips* stabbing happened AFTER death.+Yes/c the cause of death is for once NOT the big knife stuck to the victim's body.+It's hard to determine exactly when death occured/c but I'd say between 12:00 AM and 3:00 AM.+As for cause of death/c my money is on some fast acting poison.+That's all I have for now.+Feel free to look around.,Madam Bear should know more+Come back after you've talked to her.{a}Madam Bear was upset about something.+ I saw her arguing with Master Bear yesterday before dinner.+Then Master Bear had another argument with Mr. Lizard during dinner.+He was very upset he went to his room.+In the morning Madam Bear was sleeping in the living room.+Then I found him.+I still can't get the Image out of my head.[o],You should begin by asking the Mrs. Bear.{a}I am not sure exactly what happened/c all I know is the maid seems to have found the body and woke me up with her scream.,Speak with the lasy of the house .{a}*Oink* I was kinda out of it yesterday so I will not be much help.+They told me the maid was screaming in the morning or something but I didn't hear it *oink*.,We were celebrating the opening of a new branch of Bear and Co Inc.+Lawrence Lizard is going to be the head of that branch.+There was a fight/c Lawrence said something that angered Beric so Beric flipped out and went to his room.+Some of the guests/c Mr. Lizard/c Mrs. Salamander/c and Mr. Pig/c were tired or drunk so they stayed over in the guest room.+In the morning we heard Ms. Rabbit screaming and...+... and he was dead.[a],Mrs. Bear would know more.{a}I am sorry I can't help much.+I only heard the scream.,Mrs. Bear would know more.{a}I wasn't here yesterday but I heard Rachel scream and came in as fast as I could.+I went in after Mr. Cat and saw the body.+Horrifying stuff.
what happened,You should ask mom first{a}All I know is I woke up to Rachel screaming.+I rushed upstairs to find that horrible site.+I called Ms. Jaguar immedietly to see him.+She examined the body/c so she might be more useful.,I think you should ask Madam Bear first{a}I wrote it all down in my journal+Let's see…+6:00 PM The first guests arrives/c Mr. Lizard and his wife Mrs. Salamander.+ Mr. Pig arrives late/c as always/c at around 7:30 PM.+Master Beric left the dinner table to his room at 10:30 PM after a fight errupted between him and Mr. Lizard.+Most of the guests left after the argument/c however/c Mr. Lizard and Mrs. Salamander opted to stay since they were tired.+Mr. Pig was drunk/c of course/c and decided to stay too.+The guests stayed up with Madam Bear and her son until around 12:00 AM when all went to sleep.+ Madam Bear could not sleep and came down to the kitchen to talk to me at around 1:00 AM.+Ms. Rabbit and I were done cleaning the dishes at around 2:00 AM/c at which point We both went to sleep in our dorms. Located outside this house/c in the other building.+We woke up at 6:00 AM to start working around the house.+We found Madam Bear sleeping in the living room.+When Ms. Rabbit went to check on Master Bear/c she...+I swear it was the most horrifying scream I heard in my life.+and Master Bear he was...+...dead/c stabbed.+That's all I have/c maybe Ms. Rabbit would know more.[o],You should start by asking Mrs. Bear{a}I examined the *licks lips* body.+I suggest you take a look before we discuss it.{b}I think you saw what I saw.+Not much blood.+This tells me that the *licks lips* stabbing happened AFTER death.+Yes/c the cause of death is for once NOT the big knife stuck to the victim's body.+It's hard to determine exactly when death occured/c but I'd say between 12:00 AM and 3:00 AM.+As for cause of death/c my money is on some fast acting poison.+That's all I have for now.+Feel free to look around.,Madam Bear should know more+Come back after you've talked to her.{a}Madam Bear was upset about something.+ I saw her arguing with Master Bear yesterday before dinner.+Then Master Bear had another argument with Mr. Lizard during dinner.+He was very upset he went to his room.+In the morning Madam Bear was sleeping in the living room.+Then I found him.+I still can't get the Image out of my head.[o],You should begin by asking the Mrs. Bear.{a}I am not sure exactly what happened/c all I know is the maid seems to have found the body and woke me up with her scream.,Speak with the lasy of the house .{a}*Oink* I was kinda out of it yesterday so I will not be much help.+They told me the maid was screaming in the morning or something but I didn't hear it *oink*.,We were celebrating the opening of a new branch of Bear and Co Inc.+Lawrence Lizard is going to be the head of that branch.+There was a fight/c Lawrence said something that angered Beric so Beric flipped out and went to his room.+Some of the guests/c Mr. Lizard/c Mrs. Salamander/c and Mr. Pig/c were tired or drunk so they stayed over in the guest room.+In the morning we heard Ms. Rabbit screaming and...+... and he was dead.[a],Mrs. Bear would know more.{a}I am sorry I can't help much.+I only heard the scream.,Mrs. Bear would know more.{a}I wasn't here yesterday but I heard Rachel scream and came in as fast as I could.+I went in after Mr. Cat and saw the body.+Horrifying stuff.
problem,You should ask mom first{a}All I know is I woke up to Rachel screaming.+I rushed upstairs to find that horrible site.+I called Ms. Jaguar immedietly to see him.+She examined the body/c so she might be more useful.,I think you should ask Madam Bear first{a}I wrote it all down in my journal+Let's see…+6:00 PM The first guests arrives/c Mr. Lizard and his wife Mrs. Salamander.+ Mr. Pig arrives late/c as always/c at around 7:30 PM.+Master Beric left the dinner table to his room at 10:30 PM after a fight errupted between him and Mr. Lizard.+Most of the guests left after the argument/c however/c Mr. Lizard and Mrs. Salamander opted to stay since they were tired.+Mr. Pig was drunk/c of course/c and decided to stay too.+The guests stayed up with Madam Bear and her son until around 12:00 AM when all went to sleep.+ Madam Bear could not sleep and came down to the kitchen to talk to me at around 1:00 AM.+Ms. Rabbit and I were done cleaning the dishes at around 2:00 AM/c at which point We both went to sleep in our dorms. Located outside this house/c in the other building.+We woke up at 6:00 AM to start working around the house.+We found Madam Bear sleeping in the living room.+When Ms. Rabbit went to check on Master Bear/c she...+I swear it was the most horrifying scream I heard in my life.+and Master Bear he was...+...dead/c stabbed.+That's all I have/c maybe Ms. Rabbit would know more.[o],You should start by asking Mrs. Bear{a}I examined the *licks lips* body.+I suggest you take a look before we discuss it.{b}I think you saw what I saw.+Not much blood.+This tells me that the *licks lips* stabbing happened AFTER death.+Yes/c the cause of death is for once NOT the big knife stuck to the victim's body.+It's hard to determine exactly when death occured/c but I'd say between 12:00 AM and 3:00 AM.+As for cause of death/c my money is on some fast acting poison.+That's all I have for now.+Feel free to look around.,Madam Bear should know more+Come back after you've talked to her.{a}Madam Bear was upset about something.+ I saw her arguing with Master Bear yesterday before dinner.+Then Master Bear had another argument with Mr. Lizard during dinner.+He was very upset he went to his room.+In the morning Madam Bear was sleeping in the living room.+Then I found him.+I still can't get the Image out of my head.[o],You should begin by asking the Mrs. Bear.{a}I am not sure exactly what happened/c all I know is the maid seems to have found the body and woke me up with her scream.,Speak with the lasy of the house .{a}*Oink* I was kinda out of it yesterday so I will not be much help.+They told me the maid was screaming in the morning or something but I didn't hear it *oink*.,We were celebrating the opening of a new branch of Bear and Co Inc.+Lawrence Lizard is going to be the head of that branch.+There was a fight/c Lawrence said something that angered Beric so Beric flipped out and went to his room.+Some of the guests/c Mr. Lizard/c Mrs. Salamander/c and Mr. Pig/c were tired or drunk so they stayed over in the guest room.+In the morning we heard Ms. Rabbit screaming and...+... and he was dead.[a],Mrs. Bear would know more.{a}I am sorry I can't help much.+I only heard the scream.,Mrs. Bear would know more.{a}I wasn't here yesterday but I heard Rachel scream and came in as fast as I could.+I went in after Mr. Cat and saw the body.+Horrifying stuff.
crime scene,That would be the bedroom.+It's the door to your left when you enter the house.,I believe that would be the bedroom.+It's the door to your left when you enter the house.,Ummm…+You're here.,The bedroom where I found Master Bear.+It's the door to your left when you enter the house.,It's the door to the left.,I'm not *oink* sure.,That door to my left.+It's the bedroom.,It's the door to the left.,The body is in the bedroom.
name,Brandon Bear/c at your service.,Caleb Cat/c the family butler.,Dr. Julia Jaguar/c Mr. Bear Senior's personal physician.,Rachel/c Rachel Rabbit.+I'm the maid.,Lawrence Lizard/c entrepreneur and Berics bus…+former business partner.,I am Paul *oink* Pig.+I work in IT at Mr. Bear's company.+Well/c I guess it's Mr. Lizard's now *oink*.,Berna Bear/c Beric's…widow.,I am Sara Salamander.+ I am Lawrence's wife and business partner.,Gustavo Gnu+Gardner.
scales,?,?,?,?,I'm not sure what you're talking about{s}Oh…+You found them in the room haven't you?+Okay I'll admit it I went to the room at night+but I did not kill him.+I was looking for some documents.+Look/c I owe Beric a hefty sum.+That was what we were arguing about yesterday.+I wanted to find his debt ledger to change it.+Then I heard someone come in so I hid under the table.+I heard a thud. Then running.+I think that was when Beric was killed it's just..+I didn't think that was what happened at the time.+I didn't hear Beric at all so I thought that someone was/c I don't know/c cleaning or something+I swear that was what happened.+You gotta believe me.[c],?,?,I'm not sure what you're talking about{s}These looks like my husband's.+He's been shedding lately.,?
birthday,Seventh of June,I was born on the forth of September,I was born on the second of January,I was born on the third of October,I was born on the fifteenth of April.,I was born on the twenty fifth of January,I was born on the forth of December,I was born on the ninth of November,Umm…I was born on the fifth of November.[i]{i}I was born on the fifth of November.
medicine,?,Master Bear was very adement about taking his medicine on time.+He kept a full ledger detailing everything.+Not sure where it is though.,Bear was very schedule oriented.+He always took his medicine on time/c never missed a pill.+{m}Bear was very schedule oriented.+He always took his medicine on time/c never missed a pill.+The medicine you found was for his Hypertension.,?,?,?,My husband was a hypochondriac.+He was always going about how this and that will kill him.+Well. Apparently something did eventually.,?,?
meds,?,Master Bear was very adement about taking his medicine on time.+He kept a full ledger detailing everything.+Not sure where it is though.,Bear was very schedule oriented.+He always took his medicine on time/c never missed a pill.+{m}Bear was very schedule oriented.+He always took his medicine on time/c never missed a pill.+The medicine you found was for his Hypertension.,?,?,?,My husband was a hypochondriac.+He was always going about how this and that will kill him.+Well. Apparently something did eventually.,?,?
relationship,My relationship with my father was…not good.+We didn't fight or anything but…+He was never there.+To me he was more of a…coworker…than a father.,Master Bear is a very wise and kind gentleman.+He can be very strict/c but some people here do need that strictness.,He was definitely my favorite patient.+It was hell to be around him/c true.+But a hypochondriac means consistent business.+Haha…+Well/c not anymore.,He was…nice to me.,Being his partner was profitible but…difficult.+He was very…particular about how he wanted things done.+Can't say I'm glad he's gone though.,He was my *oink* boss.,If you're looking for motive you won't find it here.+Look/c my relationship with him wasn't the best.+He…wasn't faithful.+We had a fight yesterday about him talking to one of the women in the party.+I didn't want to cause a scene so I kept it to myselft and...+I couldn't sleep next to him that night.+Maybe if I did...,I didn't really deal with him a lot/c although I get the feeling he was hard to deal with.+You should ask my husband/c he's his business partner.,He was a good boss.
fight,?,I'm not sure what the fight was about.+Maybe you should ask Mr. Lizard about it.,?,He had an argument with Madam Bear.+and another one with Mr. Lizard.+I don't really know what they were about.+Try asking them.,It was just about how to run the company.+Nothing important.{c}It was about my debt.+He wanted me to repay him in full. IN FULL.+I don't have that kind of money right now.+He threatened to sue me.+ME/c his own partner.+He didn't even need the money.,?,He was…never faithfult to me.+At this point I didn't really care anymore but..+Yesterday he was making advances on…some woman in the party.+Right in front of me.+Our marriage was always in shambles but..+To do this right here in front of everyone?!+It's disrespectfult.+We had an argument/c and of course he just denied everything.+That's it.+I didn't want to cause a scene so I kept it to myselft and...+I couldn't sleep next to him that night.+Maybe if I did...,He did have a fight with my husband about something but not sure what.,?
argument,?,I'm not sure what the fight was about.+Maybe you should ask Mr. Lizard about it.,?,He had an argument with Madam Bear.+and another one with Mr. Lizard.+I don't really know what they were about.+Try asking them.,It was just about how to run the company.+Nothing important.{c}It was about my debt.+He wanted me to repay him in full. IN FULL.+I don't have that kind of money right now.+He threatened to sue me.+ME/c his own partner.+He didn't even need the money.,?,He was…never faithfult to me.+At this point I didn't really care anymore but..+Yesterday he was making advances on…some woman in the party.+Right in front of me.+Our marriage was always in shambles but..+To do this right here in front of everyone?!+It's disrespectfult.+We had an argument/c and of course he just denied everything.+That's it.+I didn't want to cause a scene so I kept it to myselft and...+I couldn't sleep next to him that night.+Maybe if I did...,He did have a fight with my husband about something but not sure what.,?
Bear,My father started from nothing.+Built his company from a small shop to a major corporation.+He dedicated his life to his business.,The bear family has beed very kind to me.+They are an example for every man and woman on how you can be kind and successful.,I have been Mr. Bear's physician for/c maybe 10 years now.+They're very hard to deal with.+But they are a good source of income/c if that's what you're asking.,They are…good bosses.+I can't complain.,I only really dealt with Beric.+His son seems to want to do his own thing.+And his wife…+their marriage didn't seem to be going well.,Mr. Bear is a good *oink* boss.+His son and I are friendly.+We go *oink* fishing together sometimes.,Our family.+Me/c Brandon our son/c and..+My dead husband.,Mrs. Bear is very sweet.+We like to go shopping together on the weekends.+I think she's a very classy woman.,The head of the house.+He's the victim.
Beric,My father started from nothing.+Built his company from a small office to a major corporation.+He dedicated his life to his business.,Master Bear is a very wise and kind gentleman.+He can be very strict/c but some people here do need that strictness.,He was definitely my favorite patient.+It was hell to be around him/c true.+But a hypochondriac means consistent business.+Haha…+Well/c not anymore.,He was…nice to me.,Being his partner was profitible but…difficult.+He was very…particular about how he wanted things done.+Can't say I'm glad he's gone though.,He was my *oink* boss.,My late husband.,I didn't really deal with him a lot/c although I get the feeling he was hard to deal with.+You should ask my husband/c he's his business partner.,The head of the house.+He's the victim.
Brandon,I like fishing…,He's a very peculiar person.+He always seems to want to deal with things on his own.+Maybe it's because he doesn't want to be seen as a man who benefited from his father's wealth.,I was onlt Mr. Bear senior's physician.+I don't know much about his son.,He is a good man.+He was always nice to me even if I did something wrong.+He'd even help me fix it.,I only really dealt with Beric.+His son seems to want to do his own thing.,He's my friend.+We go *oink* fishing together sometimes.,My son always despised living in his father's shadow.+He might not say it out loud but he wants to be seen as a success on his own mertis.,I didn't really deal with him a lot/c although I get the feeling he was hard to deal with.,I think he's a good man.+He doesn't talk much.
Berna,My mom is so sweet.+She had to tolerate a lot from my father.+Yet she kept looking forward.,Madam Berna is a sweet woman.+She was a supportive wife to Master Beric and a wonderful mother to Master Brandon.+I can't begin to know how she must be devestated right now.,I was onlt Mr. Bear senior's physician.+I don't know much about his wife.,She…she's sweet but I always felt she did not like me.[r],I only really dealt with Beric.+Although a blind man can see his marriage didn't seem to be going well.,She's a sweet lady.+I don't *oink* know her that well.,That would be me.,She's very sweet.+We like to go shopping together on the weekends.+I think she's a very classy woman.,She's sweet enough/c I suppose.
Cat,The family butler.+I think he shared my father's personality in a sense.+Very particular and a bit harsh on the staff.,That would be me/c sir.,I don't know him much.,He's…Mr. Beric's right hand man in a lot of ways.+He is very loyal to the family and to Mr. Bear especially.,I don't know him much.,I don't know him much.,Caleb is a loyal butler and very helpful.+He share's Beric's way of doing things.,I don't know him much.,He's the butler.+I'm the gardener so I don't deal with him a lot.
Caleb,The family butler.+I think he shared my father's personality in a sense.+Very particular and a bit harsh on the staff.,That would be me/c sir.,I don't know him much.,He's…Mr. Beric's right hand man in a lot of ways.+He is very loyal to the family and to Mr. Bear especially.,I don't know him much.,I don't know him much.,Caleb is a loyal butler and very helpful.+He share's Beric's way of doing things.,I don't know him much.,He's the butler.+I'm the gardener so I don't deal with him a lot.
Jaguar,Kinda creepy to be honest.,She always seems…alert.,*licks lips* It's me,She looks at me in a strange way sometimes.,I don't know her.,I don't know her much *oink*.+I saw her when she came today and her pupils grew *oink*.,She seems to be a good doctor but she's…strange.,I don't know her.,I don't know her much.
Julia,Kinda creepy to be honest.,She always seems…alert.,*licks lips* It's me,She looks at me in a strange way sometimes.,I don't know her.,I don't know her much *oink*.+I saw her when she came today and her pupils grew *oink*.,She seems to be a good doctor but she's…strange.,I don't know her.,I don't know her much.
Rabbit,She's a dedicated maid.+I feel she's not on the best terms with Caleb though.,She's not the brightest of the staff but she's good at her job/c I guess.,*licks lips* WHERE?!+Oh..sorry..I don't know her.,That's me.,I don't know her.,I don't know her.,She's a very good maid.+She's helpful and dedicated.+Which is all you can ask really.,I don't know her.,She's…nice.{f}I did propose to her but I broke it off because…we wouldn't work out.
Rachel,She's a dedicated maid.+I feel she's not on the best terms with Caleb though.,She's not the brightest of the staff but she's good at her job/c I guess.,*licks lips* WHERE?!+Oh..sorry..I don't know her.,That's me.,I don't know her.,I don't know her.,She's a very good maid.+She's helpful and dedicated.+Which is all you can ask really.,I don't know her.,She's…nice.{f}I did propose to her but I broke it off because…we wouldn't work out.
